"","Num","POD","SD","%","Genes","KE"
"GO:0051899","3","0.0156804304272841","0.145375673808848","14.29","adora2aa, jun, kdr","OCCURRENCE A PAROXYSMAL DEPOLARIZING SHIFT; PROLONGED DEPOLARIZATION OF NEURONAL MEMBRANE"
"GO:1904019","4","0.0500851907996594","0.229573407204202","18.18","eif2s1b, hmox1a, kdr, tgfbr2","DECREASE APOPTOSIS OF CILIATED EPITHELIAL CELLS"
"GO:0006915","3","0.122842647811997","0.467580736702531","9.68","dap3, sgk1, tgfbr2","CHANGES/INHIBITION CELLULAR HOMEOSTASIS AND APOPTOSIS; DECREASED APOPTOSIS EPITHELIAL CELLS; INCREASED APOPTOSIS DECREASED LEYDIG CELLS"
"SQUAMOUS CELL CARCINOMA","3","0.24951076910403","0.324057427961794","30","ctsc, ddb2, tgfbr2","INCREASE PAPILLOMAS/CARCINOMAS SQUAMOUS CELLS; INCREASE RESPIRATORY OR SQUAMOUS METAPLASIA; SQUAMOUS METAPLASIA ABERRANT BASAL CELLS"
"GO:0001935","5","0.264472035339691","0.267476487601919","13.89","arnt, hmox1a, jun, kdr, xbp1","INCREASED PROLIFERATION ENDOTHELIAL CELLS"
"GO:0060291","2","0.287850015086971","0.628064823115649","14.29","adora2aa, serpine2","DECREASED LONG-TERM POTENTIATION LTP"
"SYNAPTIC TRANSMISSION GLUTAMATERGIC","2","0.287850015086971","0.628064823115649","15.38","adora2aa, serpine2","REDUCED PRESYNAPTIC RELEASE OF GLUTAMATE"
"GO:0010463","2","0.313677528144818","0.637553319886617","16.67","tgfbr2, zeb1b","INCREASED PROLIFERATION OF MESENCHYMAL CELLS"
"GO:0019932","7","0.332994973419987","0.229262171952015","11.48","adora2aa, adora2b, adrb3a, gsk3ab, kdr, ndufs4, ptger2a","INCREASED SECOND MESSENGER PRODUCTION"
"GO:0006954","7","0.445525187350095","0.194999378923144","5.98","adora2aa, adora2b, ctsc, f11r.1, hmox1a, jun, ptger2a","INCREASE INFLAMMATION; INCREASE INFLAMMATION CORNEAL CELLS; INFILTRATION INFLAMMATORY CELLS; INCREASED INFLAMMATION; CHRONIC COUGH RESPIRATORY IRRITABILITY"
"CTOME VEGFR2 MEDIATED CELL PROLIFERATION","2","0.460905882691119","1.37643706550044","33.33","kdr, vegfaa","INHIBITION VEGFR2"
"GO:0016310","9","0.482549462690369","0.159079481283434","7.2","cdk6, gsk3ab, GSK3B_2of2, ilk, kdr, nme3, sgk1, strap, tgfbr2","ACTIVATION SP1"
"IMMUNOLOGIC HYPERSENSITIVITY","3","0.493826167037018","0.496991705014214","13.04","odc1, ptger2a, srsf2a","INCREASE ALLERGIC RESPIRATORY HYPERSENSITIVITY RESPONSE"
"BREAST CANCER PATHWAY","4","0.520479448700427","0.305054631531948","3.51","cdk6, ddb2, jun, tcf7l1a","N/A BREAST CANCER"
"GO:0007269","3","0.524382012829578","0.502297688916795","12","adora2aa, adora2b, gad2","OVERACTIVATION NEURONOTRANSMITTER RELEASE"
"GO:0050673","10","0.549227460186508","0.137363824678679","12.2","arnt, cdk6, hmox1a, hnf1ba, igfbp5b, jun, kdr, lamb1a, strap, xbp1","INCREASE REGENERATIVE CELL PROLIFERATION TUBULAR EPITHELIAL CELLS; INCREASE REGENERATIVE CELL PROLIFERATION TERMINAL BRONCHIOLAR EPITHELIAL CELLS"
"ABNORMAL CORNEAL EPITHELIUM MORPHOLOGY","2","0.573002241898538","0.452522627796582","15.38","ddb2, zeb1b","INCREASED ACCUMULATION OF ALPHA2U MICROGLOBULIN PROXIMAL TUBULAR EPITHELIUM"
"GO:0009611","12","0.57855084871629","0.0989271919714086","10.71","adora2aa, anxa2a, ehd1b, f11r.1, gata5, hmox1a, ilk, jun, pabpc4, serpine2, tgfbr2, xbp1","ACCUMULATION DAMAGED MITOCHONDRIAL DNA"
"GO:0072358","11","0.625481018639946","0.122941211449958","9.91","anxa2a, cdx4, dnmt1, hmox1a, jun, kdr, sod2, tbx20, tfap2b, tgfbr2, xbp1","ALTERED CARDIOVASCULAR DEVELOPMENT/FUNCTION"
"ABNORMALITY OF REPRODUCTIVE SYSTEM PHYSIOLOGY","5","0.641907593725146","0.259263970718767","4.85","ddb2, eif2b2, hnf1ba, prpf31, smarcb1a","N/A IMPAIRMENT OF REPRODUCTIVE CAPACITY"
"GO:0005102","13","0.724240252939629","0.0924555413116655","6.25","adora2aa, arnt, bambia, f11r.1, gsk3ab, ilk, kdr, lamb1a, rqcd1, serpine2, strap, tbp, tgfbr2","DECREASED TESTOSTERONE BINDING TO ANDROGEN RECEPTOR HYPOTHALAMUS"
"NEOPLASM OF THE SKIN","5","0.730249609977761","0.244175700707619","15.15","ctsc, ddb2, fh, smarcb1a, tgfbr2","SENSITISATION SKIN"
"SOMATIC MUTATION","3","0.755445227033531","0.512298911503253","3.57","rad54l, smarcb1a, tgfbr2","INCREASED INDUCED MUTATIONS IN CRITICAL GENES; INCREASE MUTATIONS; INCREASE MUTATIONS IN CRITICAL GENES"
"GO:0042060","11","0.786059434694508","0.104300148048529","12.5","adora2aa, anxa2a, ehd1b, f11r.1, gata5, hmox1a, ilk, pabpc4, serpine2, tgfbr2, xbp1","FAILURE IN VASCULAR REPAIR MECHANISMS UNRESOLVED BLOOD LOSS HEMORRHAGE"
"ABNORMAL CARDIAC TEST","2","0.800796772575512","1.04993565677208","15.38","gmppb, tbx20","INCREASED CARDIAC ARRTHYMIA"
"GO:0009790","17","0.826382779064505","0.0815133981176683","10.06","aldh1a3, arnt, cdx4, dnmt1, hnf1ba, hoxb8a, kdr, lamb1a, lhx2b, neurog1, pax5, rps6, ssr2, tbx20, tgfbr2, th, zeb1b","DEFECT OF EMBRYOGENESIS"
"SMOOTH MUSCLE CELL PROLIFERATION","6","0.882953985263512","0.217447805892697","23.08","dnmt1, hmox1a, igfbp5b, jun, sod2, tgfbr2","HYPERTROPHY/HYPERPLASIA SMOOTH MUSCLE"
"GO:0007588","3","0.9504149257778","0.47596420202081","21.43","adora2aa, adora2b, hmox1a","INCREASE BILIARY EXCRETION TH GLUCURONIDE"
"GO:0044703","12","1.00298348923242","0.116621893039323","10.34","hsd11b2, igfbp5b, pax5, RPL29, rpl39, rps6, ruvbl1, serpine2, sirt2, tbp, tgfbr2, th","N/A REPRODUCTIVE FAILURE"
"PEPTIDYL LYSINE MODIFICATION","9","1.18633245315417","0.122472694455917","12.68","arnt, dnmt1, hdac6, nup188, pax5, ruvbl1, sirt2, smarcb1a, uba2","N/A COVALENT BINDING TO PROTEIN POSSIBLY LYSINE RESIDUE"
"PROSTAGLANDIN SYNTHESIS AND REGULATION","3","1.21621993966873","0.626298559055722","11.54","anxa2a, hsd11b2, ptger2a","REDUCTION PROSTAGLANDIN E2 CONCENTRATION; REDUCED PROSTAGLANDIN F2ALPHA CONCENTRATION PLASMA"
"ABNORMAL LIVER MORPHOLOGY","8","1.23818266361117","0.130651254816759","6.72","ctsc, hmox1a, hnf1ba, hsd3b7, ndufs4, pgm1, pigs, srsf2a","INDUCTION LIVER “DYSFUNCTIONAL” CHANGES BY CGA 330050; INFLAMMATION LIVER; N/A LIVER FIBROSIS; INCREASE RBC CONGESTION IN LIVER; INCREASE LIVER AND SPLENIC HEMOSIDEROSIS; REDUCTION VITELLOGENIN SYNTHESIS IN LIVER; INCREASE VITELLOGENIN SYNTHESIS IN LIVER; FORMATION LIVER FIBROSIS; FORMATION LIVER TUMOR"
"HEART DEVELOPMENT","7","1.23837374534135","0.222602711160004","5.56","dhrs3a, gata5, gsk3ab, tbx20, tgfbr2, th, vegfaa","ALTERED LARVAL DEVELOPMENT; IMPAIRED DEVELOPMENT"
"ABNORMALITY OF THE ABDOMINAL ORGANS","10","1.26032932266377","0.117240878007498","5.92","ctsc, fh, hmox1a, hnf1ba, hsd3b7, ndufs4, pgm1, pigs, srsf2a, tgfbr2","IMPAIRED DEVELOPMENT OF REPRODUCTIVE ORGANS"
"ABNORMALITY OF THE LIVER","10","1.26032932266377","0.117240878007498","1.33","ctsc, fh, hmox1a, hnf1ba, hsd3b7, ndufs4, pgm1, pigs, srsf2a, tgfbr2","INCREASED INDUCTION OF UDPGT'S IN LIVER; INCREASED LIVER STEATOSIS; INCREASED LIVER STEATOSIS; N/A HEPATOTOXICITY HEPATOPATHY INCLUDING A CONSTELLATION OF OBSERVABLE EFFECTS; INDUCTION SUSTAINED HEPATOTOXICITY"
"ABNORMAL SOCIAL BEHAVIOR","3","1.29196496364124","0.346839694055921","11.54","gabbr2, grin1a, ndufs4","ABNORMAL FORAGING ACTIVITY AND BEHAVIOR"
"ENDOMETRIAL CANCER","3","1.30539154452266","0.288882537009148","4.41","ddb2, ilk, tcf7l1a","INCREASE ENDOMETRIAL ADENOCARCINOMAS"
"ABNORMAL RESPIRATORY SYSTEM MORPHOLOGY","7","1.34111897592359","0.191283784078619","4.76","ctsc, ppp1cb, rps15a, smarcb1a, srsf2a, tbx20, tgfbr2","INCREASED RESPIRATORY DISTRESS/ARREST"
"ABNORMAL LUNG MORPHOLOGY","7","1.34111897592359","0.191283784078619","5.47","ctsc, ppp1cb, rps15a, smarcb1a, srsf2a, tbx20, tgfbr2","INCREASE ADENOMAS/CARCINOMAS BRONCHIOLOALVEOLAR"
"GO:0001963","2","1.34369705417341","1.10121479586257","16.67","adora2aa, th","INCREASE DOPAMINERGIC ACTIVITY; DECREASED DOPAMINERGIC ACTIVITY"
"GO:0010468","4","1.34499135062977","0.290131850428471","25","arntl1b, cdx4, gata5, lhx2b","DECREASED TRANSCRIPTION OF GENES BY AR"
"GO:0019904","8","1.35867525872958","0.146482467819437","6.5","f11r.1, hnrnpm, ilk, jun, rqcd1, th, u2af2b, ywhaba","N/A INTERFERENCES WITH SH-/SELEN-PROTEINS"
"LOCOMOTORY BEHAVIOR","4","1.3627356271393","0.445216987322551","6.45","adora2aa, aldh1a3, hoxb8a, th","REDUCED SWIMMING SPEED; REDUCED SWIMMING PERFORMANCE"
"ABNORMALITY OF BLOOD AND BLOOD FORMING TISSUES","11","1.39808611516806","0.114901279589924","2.72","fh, hmox1a, hsd3b7, ndufs4, pgm1, rpl15, rpl27, rps15a, smarcb1a, srsf2a, tgfbr2","DAMAGING RED BLOOD CELLS; HEMOLYSIS"
"GO:0046903","17","1.45316546095029","0.0646440501341205","7.36","adora2aa, adora2b, anxa2a, CKAP4, cops5, ctsc, ctsd, gad2, hmox1a, hnf1ba, neurog1, per2, pgm1, serpine2, sgk1, tfap2b, xbp1","SUPPRESSION VLDL SECRETION; INCREASE MUCIN PRODUCTION; INCREASED SECRETION OF LOCAL GROWTH FACTORS"
"REGULATION OF CELL DEATH","23","1.54917429888318","0.0560341782696968","8.58","adora2aa, aldh1a3, arhgef2, cops5, ctsc, ctsd, dnmt1, eif2s1b, gsk3ab, hdac6, hmox1a, jun, kdr, mt2, mybl2b, rps6, sgk1, sirt2, sod2, tfap2b, ufm1, vegfaa, xbp1","N/A CELL INJURY/DEATH"
"GO:0004872","13","1.5503015240678","0.111451913313519","5.44","adora2aa, adora2b, adrb3a, fzd7a, gabbr2, grin1a, kdr, nr1i2, ptger2a, rorb, tgfbr2, thrab, vegfaa","ACTIVATION PXR/SXR"
"GO:0046983","19","1.55087705115468","0.0580641094486015","9.64","adora2aa, adrb3a, aldh1a3, arnt, atf1, f11r.1, fasn, gabbr2, gad2, hmox1a, hnf1ba, jun, neurog1, odc1, rqcd1, suclg2, tfap2b, uba2, xbp1","DIMERIZATION AHR/ARNT; REDUCED DIMERIZATION ARNT/HIF1-ALPHA"
"GO:0048870","22","1.55236883496256","0.0592446193995627","11","arhgef2, bambia, cdk6, f11r.1, gsk3ab, gtpbp4, hdac6, hmox1a, hsd3b7, igfbp5b, ilk, jun, kdr, lamb1a, onecut1, serpine2, sgk1, sod2, strap, tbx20, tgfbr2, xbp1","INCREASED MOTILITY"
"GO:0040011","25","1.58456301484686","0.0520309857806873","11.01","adora2aa, arhgef2, bambia, cdk6, f11r.1, gsk3ab, gtpbp4, hdac6, hmox1a, hsd3b7, igfbp5b, ilk, jun, kdr, lamb1a, lhx2b, onecut1, rpl24, serpine2, sgk1, sod2, strap, tbx20, tgfbr2, xbp1","INCREASED LOCOMOTION; INCREASED MUSCULAR WAVES IN FOOT; DECREASED LOCOMOTION"
"CHOLESTASIS","3","1.58460949942491","0.57735300474116","8.57","fh, hnf1ba, hsd3b7","INCREASED CHOLESTASIS; CHOLESTASIS PATHOLOGY"
"GO:0007568","12","1.58716798134576","0.110813294083752","13.95","cdk6, ctsc, eif2s1b, gsk3ab, igfbp5b, ilk, jun, pax5, rad54l, sod2, tgfbr2, th","ACCELERATED AGING"
"GO:0003824","5","1.59485856537294","0.309881567611651","7.69","aldoaa, fh, gad2, odc1, suclg2","DECREASED DHB4/HSD17B4; DECREASE INCORPORATION OF ACTIVE IODIDE INTO IODOTYROSINES; INHIBITION PROLYL HYDROXYLASES; INHIBITION UROD; DECREASE AKT/ENOS ACTIVITY; INHIBITION DEIODINASE 2; INHIBITION DEIODINASE 1; INHIBITION IODOTYROSINE DEIODINASE IYD; INHIBITION DEIODINASE 3; INHIBITION DUAL OXIDASE; INDUCTION UPREGULATION OF GLUCURONYLTRANSFERASE ACTIVITY"
"GO:0008137","2","1.67257097325337","0.927904660004998","22.22","C24H11orf65, ndufs4","INHIBITION NADH-UBIQUINONE OXIDOREDUCTASE COMPLEX I"
"GO:0003158","5","1.68067802775047","0.294443941096761","20.83","anxa2a, f11r.1, fasn, kdr, zeb1b","IMPAIRMENT ENDOTHELIAL NETWORK"
"ABNORMALITY OF THE BLADDER","5","1.768925894727","0.22323534828451","9.62","cdk6, copb2, dnmt1, smarcb1a, tbp","REDUCED POSTERIOR SWIM BLADDER INFLATION; REDUCED ANTERIOR SWIM BLADDER INFLATION; INCREASE URINARY BLADDER CALCULI"
"REGULATION OF WNT SIGNALING PATHWAY","6","1.80609004991059","0.159953619683479","7.59","arntl1b, bambia, gsk3ab, ilk, ruvbl1, tcf7l1a","INHIBITION WNT PATHWAY"
"GO:0006412","13","1.99905732759714","0.125802153604732","12.04","C21H18orf32, eif2b2, eif2s1b, rpl15, rpl24, rpl27, RPL29, rpl39, rpl4, rps12, rps15a, rps18, rps6","ALTERED PROTEIN PRODUCTION"
"GO:0006839","4","2.15614944683902","0.337859495973774","8.7","atp5d, COX5B_2of3, gsk3ab, ywhaba","REDUCTION CHOLESTEROL TRANSPORT IN MITOCHONDRIA"
"GO:0099536","7","2.24595638804334","0.161626605549077","6.31","adora2aa, adora2b, gabbr2, gad2, gsk3ab, serpine2, th","DECREASED NEURONAL NETWORK FUNCTION IN ADULT BRAIN; DECREASED NEURONAL NETWORK FUNCTION IN ADULT BRAIN"
"GO:0000003","18","2.25149058141347","0.0704096818079491","8.87","arnt, cdx4, eif2b2, hsd11b2, igfbp5b, neurog1, pax5, rad54l, RPL29, rpl39, rps6, rqcd1, ruvbl1, serpine2, sirt2, tbp, tgfbr2, th","REDUCED REPRODUCTIVE SUCCESS; REPRODUCTIVE FAILURE"
"UPPER MOTOR NEURON DYSFUNCTION","17","2.25423431263682","0.069288401015667","3.59","ap1s2, copb2, ctsd, ddb2, dnmt1, eif2b2, gabbr2, gmppb, grin1a, lamb1a, ndufs4, odc1, smarcb1a, tbp, tgfbr2, th, ufm1","DECREASE HISTAMINERGIC NEURON EXCITATION; OCCURRENCE CYTOPLASMIC VACUOLIZATION BILE DUCT CELL; OCCURRENCE CYTOPLASMIC VACUOLIZATION KUPFFER CELL"
"GO:0003714","3","2.28875382433224","0.098752387557321","15","srsf2a, tfap2b, zeb1b","STABILIZATION PPAR ALPHA CO-REPRESSOR"
"CYTOPLASMIC RIBOSOMAL PROTEINS","12","2.33802036824711","0.13151746944309","8.33","C21H18orf32, rpl15, rpl24, rpl27, RPL29, rpl39, rpl4, rpl7a, rps12, rps15a, rps18, rps6","OCCURRENCE CYTOPLASMIC VACUOLIZATION PODOCYTE"
"ELECTRON TRANSPORT CHAIN","5","2.37705164800781","0.316106949106132","7.35","C24H11orf65, COX5B_2of3, dhrs3a, ndufs4, p4ha2","DISRUPTION MITOCHONDRIAL ELECTRON TRANSPORT CHAIN"
"GO:0001525","4","2.45728434877786","0.4631102720409","10.81","hdac6, kdr, mt2, vegfaa","REDUCTION ANGIOGENESIS; INCREASED ANGIOGENESIS"
"GO:0005488","96","2.52111588008323","0.0121694727923989","8.92","adrb3a, anxa2a, arf6a, arhgef2, arnt, arntl1b, arpc5a, atad5a, atf1, bambia, cdk6, cdx4, cops5, cyp2aa3, cyp2p10, ddb2, dnmt1, ehd1b, eif2b2, eif2s1b, exosc2, f11r.1, fasn, foxk2, fzd7a, gad2, gata5, gmppb, gsk3ab, GSK3B_2of2, gtpbp4, hdac6, hibadhb, hmox1a, hnf1ba, hnrnpm, hoxb8a, igfbp5b, ilk, jun, kdr, lamb1a, lhx2b, mat1a, mef2ca, meis2b, mt2, mybl2b, neurog1, nme3, nr1i2, onecut1, p4ha2, pabpc4, pax5, per2, pgm1, ppp1caa, ppp1cb, prpf31, rad54l, rassf1, rorb, rpl15, rpl24, rpl4, rpl7a, rps18, ruvbl1, sgk1, sirt2, smad3b, smarcb1a, sod2, sox1a, sqrdl, srsf2a, srsf6a, suclg2, ta, tbp, tbx20, tcf7l1a, tfap2b, tgfbr2, th, thrab, tnnc2, u2af2b, uba2, ube2e2, ube2na, vegfaa, xbp1, zeb1a, zeb1b","INCREASED BINDING OF CHEMICALS TO 2U SERUM"
"GO:0006936","4","2.53602416386488","0.348398118483179","7.27","adora2b, neurog1, tbx20, tnnc2","REDUCTION ABDOMINAL MUSCLE CONTRACTION; OVERACTIVATION MUSCLE CONTRACTION"
"DECREASED BODY WEIGHT","13","2.59494978987083","0.100349147522404","5.75","copb2, ddb2, fh, hsd11b2, hsd3b7, ndufs4, nup188, ppp1cb, rpl15, rpl27, rps15a, srsf2a, tgfbr2","DECREASED BODY WEIGHT"
"POSITIVE REGULATION OF GENE EXPRESSION","11","2.67282757298297","0.0958447463245927","6.08","arhgef2, arnt, dnmt1, gata5, gsk3ab, hmox1a, mt2, tbp, vegfaa, xbp1, znrd1","ALTERED GENE EXPRESSION"
"RESPONSE TO REACTIVE OXYGEN SPECIES","5","2.71325530032079","0.281839146235333","8.93","hdac6, hmox1a, jun, mt2, sod2","INCREASED REACTIVE OXYGEN SPECIES"
"GO:0006281","6","2.76062130542772","0.242088739811653","7.06","cops5, ddb2, fh, rad54l, ruvbl1, ube2na","N/A INSUFFICIENT OR INCORRECT DNA REPAIR; INCREASED INSUFFICIENT REPAIR OR MIS-REPAIR OF PRO-MUTAGENIC DNA ADDUCTS; OVERWHELMED MITOCHONDRIAL DNA REPAIR MECHANISMS; INCREASED DNA DAMAGE-REPAIR"
"PYRUVATE METABOLIC PROCESS","3","2.76486400886829","0.0801056320341244","5.36","arnt, nup188, pgm1","INHIBITION 4-HYDROXYPHENYL-PYRUVATE DIOXYGENASE HPPD ENZYME"
"GO:0001775","19","2.85310674717151","0.0540819810250395","9.69","adora2aa, adora2b, anxa2a, atad5a, cdk6, CKAP4, ctsc, ctsd, f11r.1, hmox1a, ilk, jun, onecut1, pgm1, rps6, serpine2, tgfbr2, xbp1, zeb1b","ACTIVATION DENDRITIC CELLS"
"GO:0005515","8","2.98083301092549","0.194420633621729","17.02","arntl1b, gata5, kdr, neurog1, smad3b, ta, tcf7l1a, vegfaa","BINDING SH-/SELEN-PROTEINS; COVALENT BINDING PROTEIN"
"ELEVATED RED CELL ADENOSINE DEAMINASE LEVEL","3","3.11542995607734","0.680993791442168","16.67","rpl15, rpl27, rps15a","INCREASED CYCLIC ADENOSINE MONOPHOSPHATE"
"PURE RED CELL APLASIA","3","3.11542995607734","0.680993791442168","15","rpl15, rpl27, rps15a","N/A METHEMOGLOBINEMIA DECREASED HEMOGLOBIN HEMATOCRIT RED BLOOD CELL NUMBER"
"GO:0030520","2","3.17661382386749","0.0677333992439151","25","rqcd1, ufm1","ACTIVATION ESTROGEN RECEPTOR ALPHA"
"GO:0030154","9","3.45141705647637","0.159136337027339","13.85","cdx4, kdr, neurog1, nr1i2, onecut1, sox1a, tgfbr2, thrab, vegfaa","DIFFERENTIATION OF MYOFIBROBLAST"
"GO:0045444","5","4.94163333400091","0.121482321582969","12.2","hdac6, per2, sirt2, tfap2b, xbp1","INCREASED ADIPOGENESIS"
"GO:0006629","11","5.40464512731304","0.0751519640984064","5.34","aldh1a3, dhrs3a, fasn, hsd11b2, hsd3b7, nr1i2, per2, pigs, sirt2, th, xbp1","ALTERATION LIPID METABOLISM"
"OXIDATIVE STRESS","3","5.42388976771086","0.297374566369238","12.5","hmox1a, mt2, sod2","PROPAGATION OXIDATIVE STRESS; N/A OXIDATIVE STRESS; INCREASE OXIDATIVE STRESS / ACTIVATION PMK-1 P38 MAPK; INCREASED OXIDATIVE STRESS; INCREASE OXIDATIVE STRESS / ACTIVATION PMK-1 P38 MAPK; INCREASE ENERGETIC DEMANDS AND THEREFORE METABOLIC STRESS; INCREASED ENERGETIC DEMANDS AND THEREFORE METABOLIC STRESS"
"ABNORMAL NASAL MORPHOLOGY","17","5.49383599424701","0.0685506891742697","10.97","ap1s2, ctsd, exosc2, fh, gata5, hdac6, nup188, odc1, pigs, ppp1cb, prpf31, rpl15, rpl27, rps15a, smarcb1a, tfap2b, txnl4a","INCREASE SITE OF CONTACT NASAL TUMORS"
"REGULATION OF PROTEOLYSIS","11","6.08518131341876","0.0816987192922904","9.82","adora2aa, anxa2a, ctsc, ctsd, grin1a, gsk3ab, hdac6, mt2, serpine2, sirt2, vegfaa","IMPAIRED PROTEOSTASIS"
"GO:0042311","4","6.11671782014848","0.370532002124737","26.67","adora2aa, adora2b, adrb3a, sod2","IMPAIRED VASODILATION"
"GO:0001816","6","6.97236582274036","0.106397420337538","5","adora2b, arhgef2, arnt, f11r.1, hmox1a, xbp1","NON-NEURONAL PRODUCTION OF TNF EPITHELIAL IRRITATION; PRODUCTION OF NERVE GROWTH FACTOR  EPITHELIAL IRRITATION; NON-NEURONAL PRODUCTION OF IL-8/CXCL1 EPITHELIAL IRRITATION"
"STEROID HORMONE MEDIATED SIGNALING PATHWAY","4","7.65144796656631","0.13865637205767","3.92","arntl1b, hdac6, rqcd1, ufm1","DECREASE STEROIDOGENIC ACUTE REGULATORY PROTEIN STAR; DECREASED HSD17B10 EXPRESSION; REDUCED MATURATION INDUCING STEROID PLASMA"
"GO:0030163","9","7.80448930330969","0.0628229763386107","5.88","anxa2a, ctsc, ctsd, gsk3ab, hdac6, odc1, serpine2, sirt2, xbp1","INCREASED CATABOLISM OF MUSCLE PROTEIN"
"GO:0016055","3","9.13804119518318","0.208584420083208","13.04","fzd7a, ta, tcf7l1a","ALTERATION WNT PATHWAY"
"GO:0045333","6","9.92627341652328","0.184051714257901","8.33","atp5d, C24H11orf65, COX5B_2of3, fh, ndufs4, suclg2","INCREASE OXIDATIVE METABOLISM"
"GO:0019098","2","10.3876941966283","0.473149972746925","22.22","serpine2, th","ALTERED REPRODUCTIVE BEHAVIOUR; REDUCED BROOD CARE"
"JNK CASCADE","3","13.4984599814661","0.237286095143693","13.64","adora2b, cops5, ube2na","ACTIVATION JNK"
"GO:1903008","2","13.6860767039743","0.374874483241285","15.38","gsk3ab, hdac6","DISRUPTION LYSOSOME"
"PSYCHOGENIC NON EPILEPTIC SEIZURE","2","14.6119603393047","0.355679883093645","15.38","fh, gabbr2","OCCURRENCE EPILEPTIC SEIZURE"
"GO:0048813","2","14.9602351210066","0.347538124381753","15.38","hdac6, ilk","ABERRANT DENDRITIC MORPHOLOGY"
"MICROTUBULE POLYMERIZATION OR DEPOLYMERIZATION","2","47.1283481891799","0.00484415541325437","20","arhgef2, hdac6","DEPOLYMERIZATION MICROTUBULE"
