"","Num","POD","SD","%","Genes","KE"
"HYPERACTIVITY","7","128.97672221567","0.0270354067352925","14","dhcr7, gabra5, gamt, gria4a, pola1, snrpb, tkta","INDUCTION ATAXIA PARALYSIS OR HYPERACTIVITY; INCREASED ATAXIA PARALYSIS OR HYPERACTIVITY; N/A ATAXIA PARALYSIS OR HYPERACTIVITY"
"GO:0003158","5","130.005336594871","0.0275788585178809","20.83","acvrl1, anxa2a, fasn, id1, rap1b","IMPAIRMENT ENDOTHELIAL NETWORK"
"REGULATION OF PROTEOLYSIS","10","130.118972902242","0.0201071808107125","8.93","anxa2a, f3a, gsk3b, hsf1, psmd10, sirt2, smad3a, stub1, syk, vegfaa","IMPAIRED PROTEOSTASIS"
"GO:0015908","4","130.790716897153","0.0841868182736322","18.18","drd2b, fabp3, pparab, syk","INCREASED FA INFLUX"
"GO:0004970","2","133.482163864363","0.0757942135440972","33.33","gria1b, gria4a","BINDING OF AGONIST IONOTROPIC GLUTAMATE RECEPTORS"
"ABNORMAL CIRCULATING CHOLESTEROL CONCENTRATION","3","138.151183445972","0.057764061333344","27.27","dhcr7, pmm2, sar1b","DECREASED CHOLESTEROL; PERTURBATION OF CHOLESTEROL"
"NCRNAS INVOLVED IN WNT SIGNALING IN HEPATOCELLULAR CARCINOMA","3","138.7798987231","0.0559553066429999","6.25","gsk3b, jun, tcf7","INCREASE HERITABLE MUTATIONS IN OFFSPRING"
"ABNORMALITY OF THE OVARY","9","140.18321115061","0.0216525608966449","15.79","eif2b4, flt1, gnrh3, hsd3b1, mre11a, pax6b, pmm2, ptpn11a, sox19b","REDUCED PROSTAGLANDINS OVARY"
"GO:0050805","4","143.506294888117","0.0271701022113662","23.53","drd1b, drd2b, gria1b, rap1b","INCREASED NEURONAL SYNAPTIC INHIBITION"
"ABNORMAL OVARIAN MORPHOLOGY","7","144.199733604055","0.0309823283261171","18.92","flt1, gnrh3, hsd3b1, pax6b, pmm2, ptpn11a, sox19b","PROMOTION OVARIAN GRANULAR CELL TUMORS; DECREASED OVARIAN E2; PROMOTION OVARIAN ADENOMAS"
"SIGNALING OF HEPATOCYTE GROWTH FACTOR RECEPTOR","4","145.750334968116","0.0267697695417218","11.76","jun, mapk3, ptpn11a, rap1b","OCCURRENCE CYTOPLASMIC VACUOLIZATION HEPATOCYTE; OCCURRENCE BALLOONING DEGENERATION HEPATOCYTE"
"GO:0019882","4","148.240187602502","0.0356314142357087","6.78","psmd10, psmd6, sar1b, sec13","GENERATION OF NOVEL EPITOPES  ANTIGEN PRESENTATION"
"CYTOPLASMIC RIBOSOMAL PROTEINS","8","150.033069057648","0.0243870041615945","5.56","rpl15, rpl19, rpl24, rpl31, rpl35a, rps24, rps25, rps9","OCCURRENCE CYTOPLASMIC VACUOLIZATION PODOCYTE"
"REGULATION OF WNT SIGNALING PATHWAY","7","150.685965833114","0.0195827152719723","8.86","gli1, gsk3b, igfbp2a, psmd10, psmd6, smad3a, wls","INHIBITION WNT PATHWAY"
"CTOME CELLULAR RESPONSE TO HYPOXIA","4","152.506397852479","0.0464881552992703","9.3","psmd10, psmd6, tceb1b, vegfaa","N/A HYPOXIA"
"HUMAN THYROID STIMULATING HORMONE TSH SIGNALING PATHWAY","4","152.772934161086","0.0187488547501171","3.7","jun, mapk3, rap1b, rb1","DECREASED TRIIODOTHYRONINE T3 IN SERUM; INCREASE THYROID-STIMULATING HORMONE TSH; DECREASED THYROXINE T4 IN SERUM; INCREASED THYROID-STIMULATING HORMONE TSH"
"GO:0045444","3","153.039175695218","0.0459728109041288","7.32","arntl1a, sirt2, smad3a","INCREASED ADIPOGENESIS"
"LOW DENSITY LIPOPROTEIN RECEPTOR PARTICLE METABOLIC PROCESS","2","155.926830430945","0.0560620592841055","33.33","anxa2a, vldlr","UP REGULATION LDLR LOW DENSITY LIPOPROTEIN RECEPTOR"
"CTOME METABOLISM OF PORPHYRINS","2","157.693953382849","0.00884551141922754","66.67","alas1, hmox1a","ACCUMULATION HIGHLY CARBOXYLATED PORPHYRINS"
"GO:0004620","2","161.734746626611","0.00107561602516647","40","chrm3a, hmox1a","INHIBITION PHOSPHOLIPASE A"
"GO:0060291","3","168.191639376793","0.0146843381331327","21.43","drd1b, drd2b, gsk3b","DECREASED LONG-TERM POTENTIATION LTP"
"BLADDER CANCER","3","170.509367189735","0.0359058675194149","7.14","rb1, rps6ka5, vegfaa","INCREASE CANCER"
"GO:0006703","2","170.637354742944","0.0313168882594237","40","hsd17b2, hsd3b1","REDUCTION 17BETA-ESTRADIOL SYNTHESIS BY OVARIAN GRANULOSA CELLS"
"LOCOMOTORY BEHAVIOR","3","172.064744778195","0.0148491194597787","4.84","drd1b, glra1, ncoa2","REDUCED SWIMMING SPEED; REDUCED SWIMMING PERFORMANCE"
"GO:0001963","2","172.257630867596","0.028441205403538","16.67","drd1b, drd2b","INCREASE DOPAMINERGIC ACTIVITY; DECREASED DOPAMINERGIC ACTIVITY"
"GO:0009058","2","173.266649620924","0.0377661339816366","28.57","alas1, gcat","INCREASED TRIGLYCERIDE FORMATION; INCREASED TRIGLYCERIDE FORMATION; DECREASE TETRAHYDROBIOPTERIN; ROS FORMATION"
"GO:0019226","2","173.741184267536","0.0310746885433783","16.67","drd1b, glra1","REDUCTION ECDYSIS MOTONEURON BURSTS"
"GO:0007588","2","175.13076541866","0.0233613673278973","14.29","drd2b, hmox1a","INCREASE BILIARY EXCRETION TH GLUCURONIDE"
"REGULATION OF PH","2","176.217333877334","0.0170147829005246","14.29","atp6v1h, mapk3","DECREASE INTRACELLULAR PH"
"GO:0007612","4","181.848879443245","0.0110041629470621","16.67","drd1b, drd2b, gabra5, jun","IMPAIRMENT LEARNING AND MEMORY"
"ABNORMAL BLOOD SODIUM CONCENTRATION","2","184.984233302894","0.00652529745930505","22.22","hsd3b1, ikbkap","DECREASED SODIUM CONDUCTANCE 2; DECREASED SODIUM REABSORPTION"
"GO:0005254","2","195.10584700007","0.00454051736387965","22.22","gabra5, glra1","ACTIVATION GLUTAMATE-GATED CHLORIDE CHANNEL; ACTIVATION GLUTAMATE-GATED CHLORIDE CHANNELS"
"GO:1902476","2","195.10584700007","0.00454051736387965","33.33","gabra5, glra1","INCREASED CHLORIDE CONDUCTANCE"
